id;buyer_id;title;transcript_type;url;notes;call_date;created_at;extracted_data;extraction_evidence;processed_at
b1cfb4d6-dc6f-4bd2-9330-201e50644e0a;b5a4957c-ff9b-4386-a3a6-7f7713b6d6ce;SourceCo-Intro-rem-Katie-Stapleton-and-Tomos-Mughan-7f113206-b544.pdf;file;da7b15c1-0781-44b3-b163-3117c8a6ef46/b5a4957c-ff9b-4386-a3a6-7f7713b6d6ce/1766533314755-SourceCo-Intro-rem-Katie-Stapleton-and-Tomos-Mughan-7f113206-b544.pdf;;;2025-12-23 23:41:56.243301+00;"{""acquisition_frequency"":""Not explicitly mentioned, but active in discussions about new deals."",""acquisition_geography"":[],""acquisition_stage"":""Scaling"",""business_model_exclusions"":[""PDR-only"",""Glass-only operations""],""business_summary"":""Puget Collision is a collision repair platform focused on acquiring and growing multi-location collision repair businesses, particularly as a franchisee of CARSTAR and Fix Auto, with an emphasis on expanding its footprint in the Pacific Northwest."",""deal_breakers"":[""No shops under $1M revenue"",""Avoid single-location businesses""],""deals_closed"":20,""deals_in_diligence"":0,""deals_under_loi"":0,""ebitda_sweet_spot"":null,""equity_committed"":""$415 million"",""geographic_exclusions"":[],""industry_exclusions"":[],""industry_vertical"":""Collision Repair / Auto Body"",""key_quotes"":[""We've grown from 11 units up to about 55."",""We have a really proven playbook for acquisitions."",""this was like I said, retained on a new platform, kind of a national search for like a 5 million EBITDA, collision repair platform that ended up not getting done."",""doing about 10 million of revenue"",""little less than 2 million of EBITDA"",""So you know, we typically look at a 5 million EBITDA, you know, collision repair platform"",""No collision repair businesses generating less than $1M in revenue"",""We specifically look for multi-location operations in collision repair"",""We have a collision platform that's based in Seattle that we've grown from 11 units up to about 55."",""We have probably done over 20 acquisitions and now span about five states in the Pacific Northwest."",""We are a franchisee of Car Star and Fixed Auto, which is part of Driven Brands.""],""key_quotes_business"":[""We have a collision platform that's based in Seattle that we've grown from 11 units up to about 55."",""We have probably done over 20 acquisitions and now span about five states in the Pacific Northwest."",""We are a franchisee of Car Star and Fixed Auto, which is part of Driven Brands.""],""key_quotes_deal_breakers"":[""No collision repair businesses generating less than $1M in revenue"",""We specifically look for multi-location operations in collision repair""],""key_quotes_geography"":[""this was like I said, retained on a new platform, kind of a national search for like a 5 million EBITDA, collision repair platform that ended up not getting done.""],""key_quotes_size"":[""doing about 10 million of revenue"",""little less than 2 million of EBITDA"",""So you know, we typically look at a 5 million EBITDA, you know, collision repair platform""],""key_quotes_thesis"":[""We've grown from 11 units up to about 55."",""We have a really proven playbook for acquisitions.""],""max_ebitda"":2,""max_revenue"":10,""min_ebitda"":1,""min_revenue"":5,""preferred_ebitda"":null,""recent_acquisitions"":[],""revenue_sweet_spot"":null,""services_offered"":""Collision repair services, operational integration, franchisee support for CARSTAR and Fix Auto"",""specialized_focus"":""Multi-location collision repair businesses"",""strategic_priorities"":""Expanding the geographic footprint within the Pacific Northwest, increasing shop count through add-on acquisitions, leveraging franchise relationships with CARSTAR and Fix Auto."",""target_geographies"":[""OR""],""thesis_confidence"":""Medium"",""thesis_summary"":""Building a regional collision repair platform focused on the Pacific Northwest, targeting shops with $1-10M revenue and potential for operational synergies in multi-location services."",""total_acquisitions"":20}";"{""extracted_at"":""2025-12-23T23:42:46.336Z"",""key_quotes_count"":11,""prompts_run"":[""thesis"",""geography"",""size"",""deal_structure"",""deal_breakers"",""business_context"",""acquisition_history""]}";2025-12-23 23:42:46.336+00
32d89514-5241-47b4-8424-3f95fb6a3c96;7173d4fe-be94-4018-ad1f-2ded0254dd9a;SourceCo-rem-Kaizen-Collision-d772a1f1-6058.pdf;file;da7b15c1-0781-44b3-b163-3117c8a6ef46/7173d4fe-be94-4018-ad1f-2ded0254dd9a/1766533022260-SourceCo-rem-Kaizen-Collision-d772a1f1-6058.pdf;;;2025-12-23 23:37:04.433495+00;"{""acquisition_geography"":[],""business_model_exclusions"":[],""business_summary"":""Kaizen Collision Center is a collision repair roll-up aiming to acquire and consolidate multiple collision repair shops, with a focus on density and operational efficiency in existing markets rather than expanding into numerous states."",""deal_breakers"":[""no single-location shops"",""avoid businesses with high customer concentration""],""geographic_exclusions"":[],""industry_exclusions"":[],""industry_vertical"":""Collision Repair / Auto Body"",""key_quotes"":[""We want to be 250, 300 locations but more dense, more consolidated in the areas we're already in."",""We're always looking for opportunity from single bolt ons and locations we're already in or if it is an opportunity in a new state and decent size we'll definitely take a look at it."",""California is one of our better markets."",""We want to be in Texas"",""California is one of our better markets"",""we don't have anything in the North NorCal"",""We're definitely looking for a form, you know, a five Shop three shop a decent volume shop that we can start doing bolt ons after that acquisition."",""The one that Tom may have mentioned that we're working with these guys are like over. Over six locations. You know EBITDA is over 2 million."",""we want to be in Texas, we want to be in certain states"",""we're definitely looking for a five shop three shop a decent volume shop that we can start doing bolt ons after that acquisition"",""We want to be 250, 300 locations but definitely more dense, more consolidated in the areas we're already in."",""We're always looking for opportunity from single bolt ons in locations we're already in.""],""key_quotes_business"":[""We want to be 250, 300 locations but definitely more dense, more consolidated in the areas we're already in."",""We're always looking for opportunity from single bolt ons in locations we're already in.""],""key_quotes_deal_breakers"":[""we want to be in Texas, we want to be in certain states"",""we're definitely looking for a five shop three shop a decent volume shop that we can start doing bolt ons after that acquisition""],""key_quotes_geography"":[""We want to be in Texas"",""California is one of our better markets"",""we don't have anything in the North NorCal""],""key_quotes_size"":[""We're definitely looking for a form, you know, a five Shop three shop a decent volume shop that we can start doing bolt ons after that acquisition."",""The one that Tom may have mentioned that we're working with these guys are like over. Over six locations. You know EBITDA is over 2 million.""],""key_quotes_thesis"":[""We want to be 250, 300 locations but more dense, more consolidated in the areas we're already in."",""We're always looking for opportunity from single bolt ons and locations we're already in or if it is an opportunity in a new state and decent size we'll definitely take a look at it."",""California is one of our better markets.""],""min_ebitda"":2,""min_revenue"":3,""services_offered"":""Collision repair, auto body repair, paint repair, and integration of bolt-on acquisition strategies."",""specialized_focus"":""Consolidating services in high-density areas and operational excellence within existing markets."",""strategic_priorities"":""Expand geographic density by consolidating locations in existing markets, with potential interest in adding shops in new geographic areas if they are of significant size and volume."",""target_geographies"":[""CA"",""TX""],""thesis_confidence"":""Medium"",""thesis_summary"":""Seeking collision repair businesses for add-on acquisitions in core markets, with a preference for those in dense geographic regions, targeting shops that can expand to around 250-300 locations, ideally those strong in volume, with significant revenue, specifically looking for bolt-on opportunities in states like California, particularly in SoCal and Texas.""}";"{""extracted_at"":""2025-12-23T23:49:11.664Z"",""key_quotes_count"":12,""prompts_run"":[""thesis"",""geography"",""size"",""deal_structure"",""deal_breakers"",""business_context"",""acquisition_history""]}";2025-12-23 23:49:11.664+00
bf94da96-12be-4bfa-a14a-8d8b421ca81a;5dc6584a-29df-4f4b-9e12-026206fe76a3;Care-Collision-ext-Chilton-Auto-140c348f-0515.pdf;file;da7b15c1-0781-44b3-b163-3117c8a6ef46/5dc6584a-29df-4f4b-9e12-026206fe76a3/1766533561889-Care-Collision-ext-Chilton-Auto-140c348f-0515.pdf;;;2025-12-23 23:46:03.39335+00;"{""acquisition_appetite"":""Actively pursuing opportunities in Northern California"",""acquisition_geography"":[""Modesto""],""acquisition_timeline"":""Not explicitly mentioned but looking to expand rapidly"",""business_model_exclusions"":[],""business_summary"":""Chilton Auto Body is a collision repair platform focusing on acquiring and integrating collision repair shops in Northern California, particularly in and around Modesto."",""deal_breakers"":[""No shops under $1M revenue"",""Avoid single-location businesses""],""geographic_exclusions"":[],""industry_exclusions"":[],""industry_vertical"":""Collision Repair"",""key_quotes"":[""We want to add you to the program, buy you out and see you guys later, our number would be quite a bit higher."",""We're actively pursuing the region, identifying brownfield locations, but we don't have the operator."",""It's strong operators, that's the rare asset."",""we're pretty concentrated in the San Francisco and, you know, a little bit of the Valley area and trying to expand outward. And we like the Northern California market and have identified Modesto, so we've been actively pursuing the region."",""We countered to GNC at 6 million, which is probably, you know, it's just a ridiculous multiple on our earnings"",""if it was, hey, you know, we want to add you to the program, buy you out and see you guys later, our number would be, you know, quite a bit higher. Like, that was kind of our exit number"",""We're open to all options regarding owner involvement post-acquisition"",""If it meant we're staying involved, we're open to taking less than our exit number"",""We don't want to overhaul your systems but we do want to overlay like incremental DRP volume that we can't like, we want it to be a value added."",""We have the two shops right now."",""Our South Modesto shop is about 18,000 square feet and Tesla certified."",""We have DRP relationships with AAA, State Farm, Allstate, and Farmers.""],""key_quotes_business"":[""We have the two shops right now."",""Our South Modesto shop is about 18,000 square feet and Tesla certified."",""We have DRP relationships with AAA, State Farm, Allstate, and Farmers.""],""key_quotes_deal_breakers"":[""We don't want to overhaul your systems but we do want to overlay like incremental DRP volume that we can't like, we want it to be a value added.""],""key_quotes_deal_structure"":[""We're open to all options regarding owner involvement post-acquisition"",""If it meant we're staying involved, we're open to taking less than our exit number""],""key_quotes_geography"":[""we're pretty concentrated in the San Francisco and, you know, a little bit of the Valley area and trying to expand outward. And we like the Northern California market and have identified Modesto, so we've been actively pursuing the region.""],""key_quotes_size"":[""We countered to GNC at 6 million, which is probably, you know, it's just a ridiculous multiple on our earnings"",""if it was, hey, you know, we want to add you to the program, buy you out and see you guys later, our number would be, you know, quite a bit higher. Like, that was kind of our exit number""],""key_quotes_thesis"":[""We want to add you to the program, buy you out and see you guys later, our number would be quite a bit higher."",""We're actively pursuing the region, identifying brownfield locations, but we don't have the operator."",""It's strong operators, that's the rare asset.""],""owner_roll_requirement"":""Open to rolling equity"",""owner_transition_goals"":""Interested in staying on and continuing operations"",""services_offered"":""Collision repair, auto body repair, specialized repairs for Tesla vehicles"",""specialized_focus"":""OEM certifications, specifically with Tesla, and strong relationships with insurance companies"",""strategic_priorities"":""Expanding footprint in Northern California, leveraging existing relationships with insurers like AAA and State Farm, and exploring additional DRP volume opportunities to increase throughput."",""target_geographies"":[""Northern California"",""Modesto""],""thesis_confidence"":""Medium"",""thesis_summary"":""Targeting collision repair shops with $1M+ revenue potential in Northern California, focusing on expanding through strong regional partners and OEM certifications.""}";"{""extracted_at"":""2025-12-23T23:49:28.836Z"",""key_quotes_count"":12,""prompts_run"":[""thesis"",""geography"",""size"",""deal_structure"",""deal_breakers"",""business_context"",""acquisition_history""]}";2025-12-23 23:49:28.836+00
9662b729-78c5-4ca9-af1a-bd11497d9ba1;5dc6584a-29df-4f4b-9e12-026206fe76a3;Chilton-SoureCo-Intro-47437987-167b.pdf;file;da7b15c1-0781-44b3-b163-3117c8a6ef46/5dc6584a-29df-4f4b-9e12-026206fe76a3/1766533548834-Chilton-SoureCo-Intro-47437987-167b.pdf;;;2025-12-23 23:45:50.43761+00;"{""acquisition_appetite"":""Very active - looking to acquire add-ons in Collision Repair"",""acquisition_frequency"":"""",""acquisition_geography"":[""CA"",""OR"",""TX""],""acquisition_stage"":""Early stage"",""acquisition_timeline"":""Looking to push forward on all three opportunities immediately."",""business_model_exclusions"":[],""business_summary"":""Chilton Auto Body is a collision repair platform focused on acquiring and integrating collision repair businesses, particularly on the East Coast and Western U.S."",""deal_breakers"":[""No shops under $1M revenue"",""Avoid single-location businesses""],""deals_closed"":0,""deals_in_diligence"":0,""deals_under_loi"":0,""ebitda_sweet_spot"":2,""equity_committed"":"""",""geographic_exclusions"":[],""industry_exclusions"":[],""industry_vertical"":""Collision Repair / Auto Body"",""key_quotes"":[""We're looking at the collision space and trying to find homes for opportunities."",""We want to express interest in opportunities on the East Coast and Western U.S."",""The owners are ready to find someone to partner with."",""Oregon's definitely been a target of ours"",""They're doing approximately five and a half to six million in revenue."",""Approximately 2 million of EBITDA."",""They're pretty flexible in terms of what that arrangement could look like or how a deal could be structured."",""If you told them, you know, hey, we don't want you to stay, they'd be open to walking away."",""We won't look at single-location shops"",""We partnered with Chilton earlier this year"",""We're looking to move fast and acquire a lot of locations quickly"",""Chilton focuses on sourcing add-on acquisitions to expand their presence in the collision repair space""],""key_quotes_business"":[""We partnered with Chilton earlier this year"",""We're looking to move fast and acquire a lot of locations quickly"",""Chilton focuses on sourcing add-on acquisitions to expand their presence in the collision repair space""],""key_quotes_deal_breakers"":[""We won't look at single-location shops""],""key_quotes_deal_structure"":[""They're pretty flexible in terms of what that arrangement could look like or how a deal could be structured."",""If you told them, you know, hey, we don't want you to stay, they'd be open to walking away.""],""key_quotes_geography"":[""Oregon's definitely been a target of ours""],""key_quotes_size"":[""They're doing approximately five and a half to six million in revenue."",""Approximately 2 million of EBITDA.""],""key_quotes_thesis"":[""We're looking at the collision space and trying to find homes for opportunities."",""We want to express interest in opportunities on the East Coast and Western U.S."",""The owners are ready to find someone to partner with.""],""max_ebitda"":2.5,""max_revenue"":10,""min_ebitda"":2,""min_revenue"":3,""owner_roll_requirement"":""Optional"",""owner_transition_goals"":""Owners want to stay involved if they can and keep leading it, but are open to walking away if necessary."",""preferred_ebitda"":25,""recent_acquisitions"":[],""revenue_sweet_spot"":6,""services_offered"":""Collision repair services across multiple locations, focusing on operational excellence and customer retention"",""specialized_focus"":""Building a network of collision repair shops with strong insurance relationships and operational capabilities"",""strategic_priorities"":""Geographic expansion in East Coast and Western U.S., focusing on creating add-on acquisitions to build scale and market presence."",""target_geographies"":[""CA"",""OR""],""thesis_confidence"":""Medium"",""thesis_summary"":""Seeking Collision Repair businesses on the East Coast or Western U.S. with revenue between $2-10M, ideally with flexible owners open to partnership."",""total_acquisitions"":0}";"{""extracted_at"":""2025-12-23T23:49:31.962Z"",""key_quotes_count"":12,""prompts_run"":[""thesis"",""geography"",""size"",""deal_structure"",""deal_breakers"",""business_context"",""acquisition_history""]}";2025-12-23 23:49:31.962+00
f816b72f-5fee-46fb-8f75-aa75e093db27;7173d4fe-be94-4018-ad1f-2ded0254dd9a;Threefold-rem-Kaizen-Intro-e87177c9-1454.pdf;file;da7b15c1-0781-44b3-b163-3117c8a6ef46/7173d4fe-be94-4018-ad1f-2ded0254dd9a/1766533038547-Threefold-rem-Kaizen-Intro-e87177c9-1454.pdf;;;2025-12-23 23:37:19.726351+00;"{""acquisition_frequency"":""unknown"",""acquisition_geography"":[],""acquisition_stage"":""unknown"",""business_model_exclusions"":[],""business_summary"":""Kaizen Collision Center is a collision repair platform focused on acquiring and integrating multiple collision repair shops, primarily in the Midwest and Southwest regions. The platform aims to optimize operational efficiencies and establish strong insurance partnerships across its locations."",""deal_breakers"":[],""deals_closed"":0,""deals_in_diligence"":0,""deals_under_loi"":0,""equity_committed"":""unknown"",""geographic_exclusions"":[],""industry_exclusions"":[],""industry_vertical"":""Collision Repair"",""key_quotes"":[""For those towns, that's about right. Man, you can run three Metal man and Painter and help her. Yeah, and three Body man if you need to."",""People just like anywhere else, they need a good quality repair and. There's only one other shop out there. And he doesn't care a lot about quality is why I ended up with that."",""I want to start buying, selling the Classic. I want to drive them. But this year I bought myself a Chevelle. My mechanics got it out here."",""I have family in Elk City, so when I saw that pop up, I was like, oh, that's cool. We have a shop out there..."",""I'm looking at a shop about four miles down..."",""I don't do much anymore."",""I prefer to keep my shops evenly distributed for less headache."",""Kaizen Collision Center has a strategic approach to acquisitions and performance enhancement."",""Dale mentioned opening three new body shops this year, indicating growth and operational expansion."",""Their focus is on providing quality repairs, with conversations about shop size and capacity across multiple locations.""],""key_quotes_acquisitions"":[],""key_quotes_business"":[""Kaizen Collision Center has a strategic approach to acquisitions and performance enhancement."",""Dale mentioned opening three new body shops this year, indicating growth and operational expansion."",""Their focus is on providing quality repairs, with conversations about shop size and capacity across multiple locations.""],""key_quotes_deal_breakers"":[""I don't do much anymore."",""I prefer to keep my shops evenly distributed for less headache.""],""key_quotes_geography"":[""I have family in Elk City, so when I saw that pop up, I was like, oh, that's cool. We have a shop out there..."",""I'm looking at a shop about four miles down...""],""key_quotes_thesis"":[""For those towns, that's about right. Man, you can run three Metal man and Painter and help her. Yeah, and three Body man if you need to."",""People just like anywhere else, they need a good quality repair and. There's only one other shop out there. And he doesn't care a lot about quality is why I ended up with that."",""I want to start buying, selling the Classic. I want to drive them. But this year I bought myself a Chevelle. My mechanics got it out here.""],""recent_acquisitions"":[],""services_offered"":""Collision repair, auto body repair, detailing, paint services, and alignment services"",""specialized_focus"":""Expansion of shop footprint in strategic geographic locations and enhancing quality of service through acquisition of well-performing shops"",""strategic_priorities"":""Expanding footprint in smaller towns, enhancing service capabilities, and strengthening relationships with major insurance providers like State Farm and Progressive"",""target_geographies"":[""OK"",""TX""],""thesis_confidence"":""Medium"",""thesis_summary"":""Seeking established Collision Repair operations in regional markets with strong insurance relationships, focusing on shops of various sizes that can contribute to geographic density and operational efficiencies."",""total_acquisitions"":0}";"{""extracted_at"":""2025-12-23T23:49:07.063Z"",""key_quotes_count"":10,""prompts_run"":[""thesis"",""geography"",""size"",""deal_structure"",""deal_breakers"",""business_context"",""acquisition_history""]}";2025-12-23 23:49:07.063+00
